{
  "base_model_fingerprint": "sha256:4a0116d439bcc286e501f459afb4fe31c9607d9233f18fb373921d991c436e66",
  "binding_status": "bound",
  "changeset_id": "changeset-changeset-0fdc6037e6dc7f71ff6ab7e4e9760c174ac26e3ce57db8f35c80308333071d1c",
  "evidence_refs": [
    "resolved:/operations/beam-restore-level-7/context/candidate_targets/0",
    "resolved:/operations/column-restore-level-0/context/candidate_targets/0",
    "resolved:/operations/door-1-fill-existing-opening/context/candidate_targets/0",
    "resolved:/operations/door-2-fill-existing-opening/context/candidate_targets/0",
    "resolved:/operations/window-1-add-with-opening/context/candidate_targets/0",
    "resolved:/operations/window-2-add-with-opening/context/candidate_targets/0"
  ],
  "operations": [
    {
      "evidence_refs": [
        "resolved:/operations/window-1-add-with-opening/context/candidate_targets/0"
      ],
      "operation_id": "window-1-add-with-opening",
      "operation_type": "add_window_with_opening_to_wall",
      "parameters": {
        "opening": {
          "height_mm": 500,
          "sill_height_mm": 2670.828,
          "width_mm": 1180
        },
        "position": {
          "center_offset_mm": 4701.961,
          "reference": "wall_local_start"
        },
        "window": {
          "fit_opening": true
        }
      },
      "semantic_assignments": [
        {
          "applicability": "required",
          "authoring_action": "set_attribute",
          "fact_key": "attribute:OverallHeight",
          "operation_id": "window-1-add-with-opening",
          "ownership": "occurrence_direct",
          "provenance": [
            "operation:window-1-add-with-opening",
            "registered-window-parameter-policy:0.2"
          ],
          "source_fact_key": "attribute:OverallHeight",
          "source_kind": "deterministic_policy",
          "source_ref": "resolved:/operations/window-1-add-with-opening/parameters/opening",
          "unit": null,
          "value": 500.0,
          "value_type": "IfcPositiveLengthMeasure"
        },
        {
          "applicability": "required",
          "authoring_action": "set_attribute",
          "fact_key": "attribute:OverallWidth",
          "operation_id": "window-1-add-with-opening",
          "ownership": "occurrence_direct",
          "provenance": [
            "operation:window-1-add-with-opening",
            "registered-window-parameter-policy:0.2"
          ],
          "source_fact_key": "attribute:OverallWidth",
          "source_kind": "deterministic_policy",
          "source_ref": "resolved:/operations/window-1-add-with-opening/parameters/opening",
          "unit": null,
          "value": 1180.0,
          "value_type": "IfcPositiveLengthMeasure"
        },
        {
          "applicability": "required",
          "authoring_action": "set_occurrence_pset",
          "fact_key": "pset:Pset_WindowCommon.IsExternal",
          "operation_id": "window-1-add-with-opening",
          "ownership": "occurrence_direct",
          "provenance": [
            "operation:window-1-add-with-opening",
            "host-wall-property:ifcopenshell.util.element.get_psets:direct",
            "window-adapter:generated-template-0.1"
          ],
          "source_fact_key": "pset:Pset_WindowCommon.IsExternal",
          "source_kind": "deterministic_policy",
          "source_ref": "current-host:2CsmzAChHF6O6maGXlo6yJ",
          "unit": null,
          "value": true,
          "value_type": "IfcBoolean"
        },
        {
          "applicability": "required",
          "authoring_action": "set_quantity",
          "fact_key": "quantity:window-base.Area",
          "operation_id": "window-1-add-with-opening",
          "ownership": "occurrence_direct",
          "provenance": [
            "operation:window-1-add-with-opening",
            "registered-window-parameter-policy:0.2"
          ],
          "source_fact_key": "quantity:window-base.Area",
          "source_kind": "deterministic_policy",
          "source_ref": "resolved:/operations/window-1-add-with-opening/parameters/opening",
          "unit": null,
          "value": 590000.0,
          "value_type": "IfcQuantityArea"
        },
        {
          "applicability": "required",
          "authoring_action": "set_quantity",
          "fact_key": "quantity:window-base.Height",
          "operation_id": "window-1-add-with-opening",
          "ownership": "occurrence_direct",
          "provenance": [
            "operation:window-1-add-with-opening",
            "registered-window-parameter-policy:0.2"
          ],
          "source_fact_key": "quantity:window-base.Height",
          "source_kind": "deterministic_policy",
          "source_ref": "resolved:/operations/window-1-add-with-opening/parameters/opening",
          "unit": null,
          "value": 500.0,
          "value_type": "IfcQuantityLength"
        },
        {
          "applicability": "required",
          "authoring_action": "set_quantity",
          "fact_key": "quantity:window-base.Width",
          "operation_id": "window-1-add-with-opening",
          "ownership": "occurrence_direct",
          "provenance": [
            "operation:window-1-add-with-opening",
            "registered-window-parameter-policy:0.2"
          ],
          "source_fact_key": "quantity:window-base.Width",
          "source_kind": "deterministic_policy",
          "source_ref": "resolved:/operations/window-1-add-with-opening/parameters/opening",
          "unit": null,
          "value": 1180.0,
          "value_type": "IfcQuantityLength"
        },
        {
          "applicability": "required",
          "authoring_action": "bind_relationship",
          "fact_key": "relationship:host",
          "operation_id": "window-1-add-with-opening",
          "ownership": "occurrence_direct",
          "provenance": [
            "resolved-host-target:2CsmzAChHF6O6maGXlo6yJ",
            "resolved-host:2CsmzAChHF6O6maGXlo6yJ",
            "operation:window-1-add-with-opening"
          ],
          "source_fact_key": "relationship:host",
          "source_kind": "surviving_target",
          "source_ref": "current-host-binding:2CsmzAChHF6O6maGXlo6yJ",
          "unit": null,
          "value": "2CsmzAChHF6O6maGXlo6yJ",
          "value_type": "IfcWallStandardCase"
        },
        {
          "applicability": "required",
          "authoring_action": "bind_relationship",
          "fact_key": "relationship:storey",
          "operation_id": "window-1-add-with-opening",
          "ownership": "occurrence_direct",
          "provenance": [
            "resolved-host-target:2CsmzAChHF6O6maGXlo6yJ",
            "operation:window-1-add-with-opening"
          ],
          "source_fact_key": "relationship:storey",
          "source_kind": "surviving_target",
          "source_ref": "current-target-storey:1vTeahUkP60PdWqwCTjSGJ",
          "unit": null,
          "value": "1vTeahUkP60PdWqwCTjSGJ",
          "value_type": "IfcBuildingStorey"
        },
        {
          "applicability": "required",
          "authoring_action": "inherit_from_type",
          "fact_key": "relationship:type",
          "operation_id": "window-1-add-with-opening",
          "ownership": "type_inherited",
          "provenance": [
            "operation:window-1-add-with-opening",
            "generated-type-template:0.1"
          ],
          "source_fact_key": "relationship:type",
          "source_kind": "deterministic_policy",
          "source_ref": "generated-type:0fC$6JBSDTk9X2I8ocWUpQ",
          "unit": null,
          "value": "0fC$6JBSDTk9X2I8ocWUpQ",
          "value_type": "IfcWindowStyle"
        }
      ],
      "semantic_manifest": {
        "manifest_id": "semantic-manifest-b1cb7bbe24d670ae5d9677c7",
        "policy_id": "window.add-with-opening.l2",
        "policy_version": "0.2"
      },
      "target": {
        "wall_global_id": "2CsmzAChHF6O6maGXlo6yJ"
      }
    },
    {
      "evidence_refs": [
        "resolved:/operations/window-2-add-with-opening/context/candidate_targets/0"
      ],
      "operation_id": "window-2-add-with-opening",
      "operation_type": "add_window_with_opening_to_wall",
      "parameters": {
        "opening": {
          "height_mm": 2370,
          "sill_height_mm": 610,
          "width_mm": 870
        },
        "position": {
          "center_offset_mm": 9315.561,
          "reference": "wall_local_start"
        },
        "window": {
          "fit_opening": true
        }
      },
      "semantic_assignments": [
        {
          "applicability": "required",
          "authoring_action": "set_attribute",
          "fact_key": "attribute:OverallHeight",
          "operation_id": "window-2-add-with-opening",
          "ownership": "occurrence_direct",
          "provenance": [
            "operation:window-2-add-with-opening",
            "registered-window-parameter-policy:0.2"
          ],
          "source_fact_key": "attribute:OverallHeight",
          "source_kind": "deterministic_policy",
          "source_ref": "resolved:/operations/window-2-add-with-opening/parameters/opening",
          "unit": null,
          "value": 2370.0,
          "value_type": "IfcPositiveLengthMeasure"
        },
        {
          "applicability": "required",
          "authoring_action": "set_attribute",
          "fact_key": "attribute:OverallWidth",
          "operation_id": "window-2-add-with-opening",
          "ownership": "occurrence_direct",
          "provenance": [
            "operation:window-2-add-with-opening",
            "registered-window-parameter-policy:0.2"
          ],
          "source_fact_key": "attribute:OverallWidth",
          "source_kind": "deterministic_policy",
          "source_ref": "resolved:/operations/window-2-add-with-opening/parameters/opening",
          "unit": null,
          "value": 870.0,
          "value_type": "IfcPositiveLengthMeasure"
        },
        {
          "applicability": "required",